[
  {
    "id": "artifact/blanchard-river",
    "node_class": "artifact",
    "kind": "entity",
    "label": "Blanchard River",
    "scope": "site",
    "links_out": 1,
    "links_in": 1,
    "lines": 14,
    "updated": "2026-08-02"
  },
  {
    "id": "artifact/npdes-2pd00028",
    "node_class": "artifact",
    "kind": "entity",
    "label": "Ottawa Wastewater Treatment Plant",
    "scope": "site",
    "links_out": 1,
    "links_in": 2,
    "lines": 14,
    "updated": "2026-08-02"
  },
  {
    "id": "artifact/site-ottawa",
    "node_class": "artifact",
    "kind": "site",
    "label": "Ottawa",
    "scope": "site",
    "links_out": 3,
    "links_in": 13,
    "lines": 14,
    "updated": null
  },
  {
    "id": "artifact/village-of-ottawa",
    "node_class": "artifact",
    "kind": "entity",
    "label": "Village of Ottawa",
    "scope": "site",
    "links_out": 1,
    "links_in": 1,
    "lines": 15,
    "updated": "2026-08-02"
  },
  {
    "id": "concept/7q10",
    "node_class": "concept",
    "kind": "concept",
    "label": "7Q10",
    "scope": "network",
    "links_out": 2,
    "links_in": 5,
    "lines": 20,
    "updated": "2026-07-01"
  },
  {
    "id": "concept/aep",
    "node_class": "concept",
    "kind": "concept",
    "label": "AEP",
    "scope": "network",
    "links_out": 3,
    "links_in": 2,
    "lines": 21,
    "updated": "2026-07-17"
  },
  {
    "id": "concept/assimilative-capacity",
    "node_class": "concept",
    "kind": "concept",
    "label": "Assimilative capacity",
    "scope": "network",
    "links_out": 2,
    "links_in": 4,
    "lines": 19,
    "updated": "2026-07-01"
  },
  {
    "id": "concept/behind-the-meter",
    "node_class": "concept",
    "kind": "concept",
    "label": "Behind-the-meter",
    "scope": "network",
    "links_out": 3,
    "links_in": 2,
    "lines": 22,
    "updated": "2026-07-17"
  },
  {
    "id": "concept/brownfield",
    "node_class": "concept",
    "kind": "concept",
    "label": "Brownfield",
    "scope": "network",
    "links_out": 2,
    "links_in": 1,
    "lines": 19,
    "updated": "2026-07-17"
  },
  {
    "id": "concept/cercla",
    "node_class": "concept",
    "kind": "concept",
    "label": "CERCLA",
    "scope": "network",
    "links_out": 4,
    "links_in": 6,
    "lines": 23,
    "updated": "2026-07-17"
  },
  {
    "id": "concept/cgp",
    "node_class": "concept",
    "kind": "concept",
    "label": "CGP",
    "scope": "network",
    "links_out": 4,
    "links_in": 4,
    "lines": 24,
    "updated": "2026-07-17"
  },
  {
    "id": "concept/closed-loop-cooling",
    "node_class": "concept",
    "kind": "concept",
    "label": "Closed-loop cooling",
    "scope": "network",
    "links_out": 3,
    "links_in": 1,
    "lines": 22,
    "updated": "2026-07-17"
  },
  {
    "id": "concept/cmar",
    "node_class": "concept",
    "kind": "concept",
    "label": "CMAR",
    "scope": "network",
    "links_out": 3,
    "links_in": 3,
    "lines": 21,
    "updated": "2026-07-17"
  },
  {
    "id": "concept/colocation",
    "node_class": "concept",
    "kind": "concept",
    "label": "Colocation",
    "scope": "network",
    "links_out": 3,
    "links_in": 2,
    "lines": 20,
    "updated": "2026-07-17"
  },
  {
    "id": "concept/common-control-plumbing",
    "node_class": "concept",
    "kind": "concept",
    "label": "Common-control plumbing",
    "scope": "network",
    "links_out": 2,
    "links_in": 2,
    "lines": 20,
    "updated": "2026-06-10"
  },
  {
    "id": "concept/conditional-use",
    "node_class": "concept",
    "kind": "concept",
    "label": "Conditional use",
    "scope": "network",
    "links_out": 3,
    "links_in": 3,
    "lines": 22,
    "updated": "2026-07-17"
  },
  {
    "id": "concept/consent-decree",
    "node_class": "concept",
    "kind": "concept",
    "label": "Consent decree",
    "scope": "network",
    "links_out": 3,
    "links_in": 1,
    "lines": 21,
    "updated": "2026-07-17"
  },
  {
    "id": "concept/constructive-denial",
    "node_class": "concept",
    "kind": "concept",
    "label": "Constructive denial",
    "scope": "network",
    "links_out": 2,
    "links_in": 1,
    "lines": 18,
    "updated": "2026-07-17"
  },
  {
    "id": "concept/consumptive-cooling",
    "node_class": "concept",
    "kind": "concept",
    "label": "Consumptive cooling",
    "scope": "network",
    "links_out": 4,
    "links_in": 9,
    "lines": 24,
    "updated": "2026-07-10"
  },
  {
    "id": "concept/cra",
    "node_class": "concept",
    "kind": "concept",
    "label": "CRA",
    "scope": "network",
    "links_out": 5,
    "links_in": 5,
    "lines": 24,
    "updated": "2026-07-17"
  },
  {
    "id": "concept/curve-number",
    "node_class": "concept",
    "kind": "concept",
    "label": "Curve number",
    "scope": "network",
    "links_out": 2,
    "links_in": 3,
    "lines": 19,
    "updated": "2026-07-17"
  },
  {
    "id": "concept/dilution",
    "node_class": "concept",
    "kind": "concept",
    "label": "Dilution",
    "scope": "network",
    "links_out": 5,
    "links_in": 3,
    "lines": 26,
    "updated": "2026-07-17"
  },
  {
    "id": "concept/dissolved-oxygen",
    "node_class": "concept",
    "kind": "concept",
    "label": "Dissolved oxygen",
    "scope": "network",
    "links_out": 3,
    "links_in": 2,
    "lines": 20,
    "updated": "2026-07-17"
  },
  {
    "id": "concept/dmr",
    "node_class": "concept",
    "kind": "concept",
    "label": "DMR",
    "scope": "network",
    "links_out": 4,
    "links_in": 6,
    "lines": 23,
    "updated": "2026-07-17"
  },
  {
    "id": "concept/echo",
    "node_class": "concept",
    "kind": "concept",
    "label": "ECHO",
    "scope": "network",
    "links_out": 6,
    "links_in": 6,
    "lines": 27,
    "updated": "2026-07-17"
  },
  {
    "id": "concept/effluent",
    "node_class": "concept",
    "kind": "concept",
    "label": "Effluent",
    "scope": "network",
    "links_out": 5,
    "links_in": 7,
    "lines": 25,
    "updated": "2026-07-17"
  },
  {
    "id": "concept/eia",
    "node_class": "concept",
    "kind": "concept",
    "label": "EIA",
    "scope": "network",
    "links_out": 2,
    "links_in": 1,
    "lines": 19,
    "updated": "2026-07-17"
  },
  {
    "id": "concept/enterprise-zone",
    "node_class": "concept",
    "kind": "concept",
    "label": "Enterprise zone",
    "scope": "network",
    "links_out": 3,
    "links_in": 3,
    "lines": 20,
    "updated": "2026-07-17"
  },
  {
    "id": "concept/epa",
    "node_class": "concept",
    "kind": "concept",
    "label": "EPA",
    "scope": "network",
    "links_out": 5,
    "links_in": 6,
    "lines": 27,
    "updated": "2026-07-17"
  },
  {
    "id": "concept/esc",
    "node_class": "concept",
    "kind": "concept",
    "label": "ESC",
    "scope": "network",
    "links_out": 3,
    "links_in": 4,
    "lines": 21,
    "updated": "2026-07-17"
  },
  {
    "id": "concept/ferc",
    "node_class": "concept",
    "kind": "concept",
    "label": "FERC",
    "scope": "network",
    "links_out": 4,
    "links_in": 4,
    "lines": 23,
    "updated": "2026-07-17"
  },
  {
    "id": "concept/ffa",
    "node_class": "concept",
    "kind": "concept",
    "label": "FFA",
    "scope": "network",
    "links_out": 2,
    "links_in": 1,
    "lines": 18,
    "updated": "2026-07-17"
  },
  {
    "id": "concept/hb",
    "node_class": "concept",
    "kind": "concept",
    "label": "HB",
    "scope": "network",
    "links_out": 2,
    "links_in": 1,
    "lines": 18,
    "updated": "2026-07-17"
  },
  {
    "id": "concept/heat-reuse",
    "node_class": "concept",
    "kind": "concept",
    "label": "Heat reuse",
    "scope": "network",
    "links_out": 2,
    "links_in": 3,
    "lines": 22,
    "updated": "2026-07-10"
  },
  {
    "id": "concept/hsg",
    "node_class": "concept",
    "kind": "concept",
    "label": "HSG",
    "scope": "network",
    "links_out": 3,
    "links_in": 3,
    "lines": 20,
    "updated": "2026-07-17"
  },
  {
    "id": "concept/huc",
    "node_class": "concept",
    "kind": "concept",
    "label": "HUC",
    "scope": "network",
    "links_out": 3,
    "links_in": 3,
    "lines": 22,
    "updated": "2026-07-17"
  },
  {
    "id": "concept/hyperscale-data-center",
    "node_class": "concept",
    "kind": "concept",
    "label": "Hyperscale data center",
    "scope": "network",
    "links_out": 3,
    "links_in": 11,
    "lines": 22,
    "updated": "2026-07-10"
  },
  {
    "id": "concept/hyperscaler",
    "node_class": "concept",
    "kind": "concept",
    "label": "Hyperscaler",
    "scope": "network",
    "links_out": 3,
    "links_in": 2,
    "lines": 20,
    "updated": "2026-07-17"
  },
  {
    "id": "concept/il6",
    "node_class": "concept",
    "kind": "concept",
    "label": "IL6",
    "scope": "network",
    "links_out": 2,
    "links_in": 1,
    "lines": 20,
    "updated": "2026-07-17"
  },
  {
    "id": "concept/interconnection-queue",
    "node_class": "concept",
    "kind": "concept",
    "label": "Interconnection queue",
    "scope": "network",
    "links_out": 4,
    "links_in": 4,
    "lines": 24,
    "updated": "2026-07-17"
  },
  {
    "id": "concept/jedd",
    "node_class": "concept",
    "kind": "concept",
    "label": "JEDD",
    "scope": "network",
    "links_out": 3,
    "links_in": 3,
    "lines": 21,
    "updated": "2026-07-17"
  },
  {
    "id": "concept/moratorium",
    "node_class": "concept",
    "kind": "concept",
    "label": "Moratorium",
    "scope": "network",
    "links_out": 3,
    "links_in": 3,
    "lines": 21,
    "updated": "2026-07-17"
  },
  {
    "id": "concept/nda",
    "node_class": "concept",
    "kind": "concept",
    "label": "NDA",
    "scope": "network",
    "links_out": 2,
    "links_in": 1,
    "lines": 19,
    "updated": "2026-07-17"
  },
  {
    "id": "concept/npdes",
    "node_class": "concept",
    "kind": "concept",
    "label": "NPDES",
    "scope": "network",
    "links_out": 8,
    "links_in": 14,
    "lines": 31,
    "updated": "2026-07-17"